{
  "schema_version": 1,
  "system_id": "system-a",
  "event_id": "6f1c2c4e-6b1a-4f2e-9b3d-1a2b3c4d5e6f",
  "game_id": "7a2d3d5f-7c2b-4a3f-8c4e-2b3c4d5e6f70",
  "round_id": "8b3e4e60-8d3c-4b4a-9d5f-3c4d5e6f7081",
  "kind": "target_hit",
  "coordinator_module_id": "module-01",
  "elapsed_us": 4210556,
  "device": {
    "boot_id": "9c4f5f71-9e4d-4c5b-ae60-4d5e6f708192",
    "uptime_us": 1832456789,
    "event_us": 1832456712
  },
  "hit_event_id": "6f1c2c4e-6b1a-4f2e-9b3d-1a2b3c4d5e6f",
  "module_id": "module-03",
  "target_index": 7,
  "detail": "impacto valido consolidado"
}
